[
  {
    "headword": "kawPuktawuh",
    "entry_metadata": {
      "page_number": 156,
      "column": "left",
      "continues_from_previous_page": false,
      "continues_to_next_page": false
    },
    "part_I": {
      "stem_preverb": "(ut...)",
      "phonetic_form": "[=kaâąwiâąÂźĂșkâątaâą wu(h)=]",
      "grammatical_info": {
        "grammatical_class": "VT",
        "verb_class": "(1)",
        "additional_forms": [
          {
            "form_type": "pl. obj.",
            "form": "kawPuktawaawuh [+ raar=]"
          },
          {
            "form_type": "du. obj.",
            "form": "si-"
          }
        ]
      },
      "glosses": [
        {
          "number": null,
          "definition": "join together",
          "usage_notes": "as when sewing two or more pieces together"
        }
      ],
      "etymology": {
        "raw_etymology": "<ka.wi.ukta (ut...)+wuh, cause to be joined together>",
        "constituent_elements": [
          {
            "morpheme": "ka.wi.ukta",
            "gloss": "to join",
            "morpheme_type": "root"
          },
          {
            "morpheme": "(ut...)",
            "gloss": "preverb",
            "morpheme_type": "preverb"
          },
          {
            "morpheme": "+wuh",
            "gloss": "causative",
            "morpheme_type": "suffix"
          }
        ],
        "literal_translation": "cause to be joined together"
      },
      "cognates": []
    },
    "part_II": {
      "paradigmatic_forms": {
        "form_1": "sitatkawPuktawu",
        "form_2": "situĆkawPuktawu",
        "form_3": "situĆkawPuktawuhuÂź",
        "form_4": "iriisiruĆkawPuktawuha",
        "form_5": "situĆkawPuktawista",
        "additional_forms": []
      },
      "examples": [
        {
          "skiri_text": "tatuuhahkawPuktawaawu",
          "english_translation": "I joined them (pl.) together.",
          "usage_context": null
        }
      ]
    },
    "compound_structure": null,
    "derived_stems": []
  },
  {
    "headword": "Ă",
    "entry_metadata": {
      "page_number": 157,
      "column": "right",
      "continues_from_previous_page": false,
      "continues_to_next_page": false
    },
    "part_I": {
      "stem_preverb": "(ut...)",
      "phonetic_form": "[-Ă- cĂ­kâąsuÂź]",
      "grammatical_info": {
        "grammatical_class": "VI",
        "verb_class": "(Ă-1-a)",
        "additional_forms": [
          {
            "form_type": "dist., du., pl. agent",
            "form": "ciks+uÂź"
          }
        ]
      },
      "glosses": [
        {
          "number": 1,
          "definition": "be on one's mind, in one's thoughts",
          "usage_notes": null
        },
        {
          "number": 2,
          "definition": "be thoughtful, considerate",
          "usage_notes": "of others"
        },
        {
          "number": 3,
          "definition": "be prayerful, reflective",
          "usage_notes": null
        }
      ],
      "etymology": {
        "raw_etymology": "<Ă (ut...) (a)ciks+uÂź, be in a condition of thought>",
        "constituent_elements": [
          {
            "morpheme": "Ă",
            "gloss": "null verb stem",
            "morpheme_type": "root"
          },
          {
            "morpheme": "(ut...)",
            "gloss": "preverb",
            "morpheme_type": "preverb"
          },
          {
            "morpheme": "(a)ciks+uÂź",
            "gloss": "thought, mind",
            "morpheme_type": "noun"
          }
        ],
        "literal_translation": "be in a condition of thought"
      },
      "cognates": []
    },
    "part_II": {
      "paradigmatic_forms": {
        "form_1": "tatuuÂźut ciksuÂź",
        "form_2": "ciksuÂź tatuuÂźut",
        "form_3": "ciksuÂź tuuÂźut",
        "form_4": "iriruuta ciksuÂź",
        "form_5": "tuutasta ciksuÂź",
        "additional_forms": []
      },
      "examples": []
    },
    "compound_structure": {
      "has_null_stem": true,
      "preverb": "(ut...)",
      "verb_stem": "Ă",
      "noun": "ciksuÂź"
    },
    "derived_stems": []
  },
  {
    "headword": "wiiĆik",
    "entry_metadata": {
      "page_number": 892,
      "column": "left",
      "continues_from_previous_page": false,
      "continues_to_next_page": false
    },
    "part_I": {
      "stem_preverb": null,
      "phonetic_form": "[-wiiâą-t,uÂź(h)]",
      "grammatical_info": {
        "grammatical_class": "VI",
        "verb_class": "(4)",
        "additional_forms": [
          {
            "form_type": "dist., du., pl. agent",
            "form": "wiiruutik"
          }
        ]
      },
      "glosses": [
        {
          "number": 1,
          "definition": "sit down, be seated",
          "usage_notes": null
        },
        {
          "number": 2,
          "definition": "stop, halt",
          "usage_notes": "as to camp"
        },
        {
          "number": 3,
          "definition": "settle, occupy; move into",
          "usage_notes": "as a dwelling"
        },
        {
          "number": 4,
          "definition": "land",
          "usage_notes": "as an airplane or a flock of birds"
        }
      ],
      "etymology": {
        "raw_etymology": "<wi+tiik, go down in an upright position>",
        "constituent_elements": [
          {
            "morpheme": "wi",
            "gloss": "downward movement",
            "morpheme_type": "prefix"
          },
          {
            "morpheme": "tiik",
            "gloss": "upright position",
            "morpheme_type": "root"
          }
        ],
        "literal_translation": "go down in an upright position"
      },
      "cognates": []
    },
    "part_II": {
      "paradigmatic_forms": {
        "form_1": "tatpiitit",
        "form_2": "tiwiiĆit",
        "form_3": "tiwiitĆikuÂź",
        "form_4": "iriirawiitiit",
        "form_5": "tiwiitiiksta",
        "additional_forms": [
          {
            "form": "sukstaapiruuĆiit",
            "description": "you (pl.) sit down there!"
          }
        ]
      },
      "examples": []
    },
    "compound_structure": null,
    "derived_stems": []
  }
]
